<?xml version="1.0" encoding="utf-8" ?>

<!--

   Copyright 2015 Blu Age Corporation - Plano, Texas

   Licensed under the Apache License, Version 2.0 (the "License");
   you may not use this file except in compliance with the License.
   You may obtain a copy of the License at

       http://www.apache.org/licenses/LICENSE-2.0

   Unless required by applicable law or agreed to in writing, software
   distributed under the License is distributed on an "AS IS" BASIS,
   WITHOUT WARRANTIES OR CONDITIONS OF ANY KIND, either express or implied.
   See the License for the specific language governing permissions and
   limitations under the License.
-->
<job id="Job4" xmlns="http://www.summerbatch.com/xmlns" xmlns:xsi="http://www.w3.org/2001/XMLSchema-instance" xsi:schemaLocation="http://www.summerbatch.com/xmlns http://www.summerbatch.com/xmlns/SummerBatchXML_1_0.xsd">
  <flow id="flow">
    <step id="chunkStep1">
      <chunk item-count="3">
        <reader ref="job4Reader" />
        <processor ref="job4Processor" />
        <writer ref="job4Writer" />
      </chunk>
      <end on="XX"/>
      <next on="*" to="chunkStep2"/>
    </step>
    <step id="chunkStep2">
      <chunk item-count="3">
        <reader ref="job4ReaderStep2" />
        <processor ref="job4ProcessorStep2" />
        <writer ref="job4WriterStep2" />
      </chunk>
    </step>
  </flow>
</job>
